{
  "version": 1,
  "title": "How an optical fibre guides light",
  "description": "A core with a higher refractive index than its cladding can guide light by total internal reflection; the external coating has a protective role. A generated text-free glass cutaway as the hero, anchored editable annotations and a separate vector inset that carries the ray geometry.",
  "eyebrow": "FIBRE STUDY / HYBRID",
  "subtitle": "One explanation, three visual directions. A conceptual step-index fibre in the ray model.",
  "width": 1440,
  "height": 1120,
  "theme": "paper",
  "footer": "Conceptual geometry, not to scale · θ is the internal incidence angle · source: OpenStax, University Physics Vol. 3, §1.4",
  "sources": [
    {
      "title": "OpenStax University Physics, Volume 3: Total Internal Reflection",
      "url": "https://openstax.org/books/university-physics-volume-3/pages/1-4-total-internal-reflection"
    }
  ],
  "panels": [
    {
      "id": "hybrid-composition",
      "x": 52,
      "y": 182,
      "width": 1336,
      "height": 858,
      "framed": false,
      "grid": false,
      "elements": [
        {
          "id": "fibre-hero",
          "type": "image",
          "x": 0,
          "y": -130,
          "width": 1336,
          "height": 890.6666666666666,
          "asset": "fibre-cutaway",
          "fit": "contain"
        },
        {
          "id": "core-label",
          "type": "callout",
          "text": "Core · n₁",
          "x": 28,
          "y": 72,
          "width": 280,
          "target": {
            "element": "fibre-hero",
            "at": [
              0.315,
              0.485
            ]
          },
          "fontSize": 25,
          "weight": "semibold",
          "side": "bottom",
          "stroke": "$ink"
        },
        {
          "id": "cladding-label",
          "type": "callout",
          "text": "Cladding · n₂",
          "x": 500,
          "y": 42,
          "width": 320,
          "target": {
            "element": "fibre-hero",
            "at": [
              0.49,
              0.395
            ]
          },
          "fontSize": 25,
          "weight": "semibold",
          "side": "bottom",
          "stroke": "$ink"
        },
        {
          "id": "coating-label",
          "type": "callout",
          "text": "Protective coating",
          "x": 1010,
          "y": 72,
          "width": 298,
          "target": {
            "element": "fibre-hero",
            "at": [
              0.835,
              0.45
            ]
          },
          "fontSize": 25,
          "weight": "semibold",
          "side": "bottom",
          "stroke": "$ink"
        },
        {
          "id": "hybrid-1",
          "type": "text",
          "text": "THE MATERIAL",
          "x": 28,
          "y": 453,
          "width": 590,
          "fontSize": 18,
          "fill": "$secondary",
          "weight": "semibold"
        },
        {
          "id": "hybrid-2",
          "type": "text",
          "text": "THE OPTICAL CONDITION",
          "x": 758,
          "y": 453,
          "width": 550,
          "fontSize": 18,
          "fill": "$secondary",
          "weight": "semibold"
        },
        {
          "id": "hybrid-ray-cladding",
          "type": "rect",
          "x": 28,
          "y": 550,
          "width": 574,
          "height": 125,
          "fill": "$secondary",
          "opacity": 0.1,
          "stroke": "$secondary",
          "strokeWidth": 1.5
        },
        {
          "id": "hybrid-ray-core",
          "type": "rect",
          "x": 28,
          "y": 581.25,
          "width": 574,
          "height": 62.5,
          "fill": "$warm",
          "opacity": 0.13
        },
        {
          "id": "hybrid-3",
          "type": "line",
          "x": 28,
          "y": 581.25,
          "x2": 602,
          "y2": 581.25,
          "stroke": "$secondary",
          "strokeWidth": 2
        },
        {
          "id": "hybrid-4",
          "type": "line",
          "x": 28,
          "y": 643.75,
          "x2": 602,
          "y2": 643.75,
          "stroke": "$secondary",
          "strokeWidth": 2
        },
        {
          "id": "hybrid-5",
          "type": "arrow",
          "x": 38,
          "y": 610.7159608683999,
          "x2": 108.36000000000001,
          "y2": 581.25,
          "stroke": "$accent",
          "strokeWidth": 3.5
        },
        {
          "id": "hybrid-6",
          "type": "arrow",
          "x": 108.36000000000001,
          "y": 581.25,
          "x2": 257.6,
          "y2": 643.75,
          "stroke": "$accent",
          "strokeWidth": 3.5
        },
        {
          "id": "hybrid-7",
          "type": "arrow",
          "x": 257.6,
          "y": 643.75,
          "x2": 406.84000000000003,
          "y2": 581.25,
          "stroke": "$accent",
          "strokeWidth": 3.5
        },
        {
          "id": "hybrid-8",
          "type": "arrow",
          "x": 406.84000000000003,
          "y": 581.25,
          "x2": 556.08,
          "y2": 643.75,
          "stroke": "$accent",
          "strokeWidth": 3.5
        },
        {
          "id": "hybrid-9",
          "type": "arrow",
          "x": 556.08,
          "y": 643.75,
          "x2": 594,
          "y2": 627.8695389975878,
          "stroke": "$accent",
          "strokeWidth": 3.5
        },
        {
          "id": "hybrid-10",
          "type": "line",
          "x": 406.84000000000003,
          "y": 524,
          "x2": 406.84000000000003,
          "y2": 657.75,
          "stroke": "$muted",
          "dash": [
            5,
            6
          ],
          "strokeWidth": 1.2
        },
        {
          "id": "hybrid-11",
          "type": "path",
          "d": "M406.84000000000003,612.5 A31.25,31.25 0 0 1 378.0156073280517,593.3213249932777",
          "stroke": "$ink",
          "strokeWidth": 1.5
        },
        {
          "id": "hybrid-12",
          "type": "text",
          "text": "θ",
          "x": 383.40250000000003,
          "y": 611.75,
          "width": 35,
          "fontSize": 25
        },
        {
          "id": "hybrid-13",
          "type": "text",
          "text": "NORMAL",
          "x": 366.84000000000003,
          "y": 494,
          "width": 180,
          "fontSize": 18,
          "fill": "$muted"
        },
        {
          "id": "hybrid-14",
          "type": "text",
          "text": "n₁ > n₂",
          "x": 28,
          "y": 704,
          "width": 560,
          "fontSize": 38,
          "weight": "semibold"
        },
        {
          "id": "hybrid-15",
          "type": "text",
          "text": "Total internal reflection occurs at the core–cladding boundary.",
          "x": 28,
          "y": 765,
          "width": 628,
          "fontSize": 24
        },
        {
          "id": "hybrid-16",
          "type": "text",
          "text": "θ > θc",
          "x": 758,
          "y": 500,
          "width": 530,
          "fontSize": 42,
          "weight": "semibold"
        },
        {
          "id": "hybrid-17",
          "type": "text",
          "text": "sin θc = n₂ / n₁",
          "x": 758,
          "y": 564,
          "width": 530,
          "fontSize": 32
        },
        {
          "id": "hybrid-18",
          "type": "text",
          "text": "θ is measured from the normal.",
          "x": 758,
          "y": 619,
          "width": 530,
          "fontSize": 24,
          "fill": "$muted"
        },
        {
          "id": "hybrid-19",
          "type": "text",
          "text": "The coating protects the glass; index contrast guides the light.",
          "x": 758,
          "y": 721,
          "width": 542,
          "fontSize": 24,
          "fill": "$muted"
        }
      ]
    }
  ],
  "assets": {
    "fibre-cutaway": {
      "path": "assets/fibre-cutaway-v1.png",
      "description": "Magnified conceptual cutaway of a straight optical fibre with an amber core, glass cladding and teal protective coating. Colours and proportions are illustrative.",
      "prompt": "+Use case: scientific-educational.\nAsset type: text-free hero illustration for a layered scientific infographic.\nPrimary request: Create a refined scientific editorial illustration of ONE optical fibre in a longitudinal cutaway. A straight horizontal cylindrical glass cladding surrounds one thinner concentric amber-tinted glass core; a matte dark-teal protective polymer coating covers the far-right portion only. The near LEFT circular cut face clearly reveals the concentric layers. Remove the front upper quadrant of the cladding over the central length to expose the core continuously. The fibre axis must remain perfectly straight and horizontal. View from slightly above and from the left so the circular end is an ellipse.\nComposition: landscape 1536 by 1024, entire object visible, occupies approximately x=12% to 88% and y=30% to 70%; generous empty space above and below. No extra objects.\nStyle: highly crafted 3D scientific plate, subtle engraved material detail, realistic translucent glass, satin polymer, fine crisp edges, restrained studio illumination, warm ivory and petrol-teal palette with a soft amber core. The materials and cutaway should be the focus.\nBackground: genuinely transparent alpha, no ground plane, no cast shadow outside the object.\nScientific constraints: core and cladding are coaxial solid glass regions with distinct refractive index, not a hollow pipe or electrical wire. This is a magnified conceptual view, not a fabrication drawing.\nNo light beams, rays or waveforms: these will be added separately as exact vectors.\nNo text, letters, numbers, formulas, labels, arrows, callouts, logos, borders or watermark anywhere.",
      "provenance": "Built-in image-generation tool, 2026-09-10. No source image supplied. Model identifier and cost were not exposed. Original RGBA output, not edited in code."
    }
  }
}
